{
  "schemaVersion": 1,
  "id": "text-field",
  "category": "input",
  "semantic": {
    "policy": "fixed",
    "defaultRole": "field"
  },
  "summary": "单行文本输入；支持 plain/labeled、密码显隐、autocomplete、字段错误与禁用状态。",
  "behavior": [
    "showLabel 默认 false：不渲染标题、无描边，填充使用 color.surface-recessed",
    "showLabel 为 true 时显示 label 并启用边框",
    "password 类型默认隐藏；revealable 通过 Lucide 眼睛图标切换显示状态且不改变输入值",
    "errorMessage 在字段内部建立错误状态与就近说明",
    "disabled 时不可聚焦或编辑，整体使用 opacity.disabled"
  ],
  "propsSchema": {
    "type": "object",
    "additionalProperties": false,
    "properties": {
      "label": {
        "type": "string"
      },
      "showLabel": {
        "type": "boolean"
      },
      "modelValue": {
        "type": "string"
      },
      "placeholder": {
        "type": "string"
      },
      "disabled": {
        "type": "boolean"
      },
      "clearable": {
        "type": "boolean"
      },
      "type": {
        "type": "string",
        "enum": ["text", "password"]
      },
      "autocomplete": {
        "type": "string",
        "enum": ["name", "username", "current-password", "new-password", "off"]
      },
      "errorMessage": {
        "type": "string"
      },
      "revealable": {
        "type": "boolean"
      }
    }
  },
  "defaultProps": {
    "label": "标题",
    "showLabel": false,
    "modelValue": "",
    "placeholder": "",
    "disabled": false,
    "clearable": false,
    "type": "text",
    "autocomplete": "off",
    "errorMessage": "",
    "revealable": false
  },
  "states": [
    {
      "id": "labeled",
      "label": "显示标题",
      "kind": "variant",
      "props": {
        "showLabel": true,
        "label": "联系人",
        "modelValue": "李明"
      }
    },
    {
      "id": "password",
      "label": "密码输入",
      "kind": "variant",
      "props": {
        "showLabel": true,
        "label": "密码",
        "type": "password",
        "revealable": true,
        "modelValue": "123456"
      }
    },
    {
      "id": "error",
      "label": "字段错误",
      "kind": "interaction",
      "props": {
        "showLabel": true,
        "label": "账号",
        "modelValue": "ab",
        "errorMessage": "账号至少 3 位"
      }
    },
    {
      "id": "disabled",
      "label": "禁用",
      "kind": "interaction",
      "props": {
        "disabled": true,
        "modelValue": "不可编辑"
      }
    }
  ],
  "slots": ["prepend-inner", "append-inner"],
  "events": ["update:modelValue"],
  "tokenBindings": {
    "border": "color.border",
    "surface": "color.surface-recessed",
    "radius": "radius.control",
    "height": "size.control",
    "label": "typography.caption",
    "input": "typography.content",
    "errorColor": "color.error",
    "errorText": "typography.caption",
    "revealColor": "color.on-surface-muted",
    "revealSize": "size.icon",
    "revealTarget": "size.touch",
    "disabledOpacity": "opacity.disabled",
    "externalLabel": "typography.label",
    "labelColor": "color.on-surface-muted",
    "labelGap": "spacing.sm"
  },
  "playground": {
    "presentation": "interactive"
  },
  "layout": {
    "summary": "标签在输入表面上方独立排版，不压住边框；标签通过 for/id 与实际输入关联。"
  }
}
