{
  "schemaVersion": 1,
  "id": "checkbox",
  "category": "input",
  "semantic": {
    "policy": "fixed",
    "defaultRole": "field"
  },
  "summary": "独立确认项；选中填充与未选中边框均为 Token-ref，勾选框圆角 radius.xs。",
  "behavior": [
    "selectedColor / uncheckedBorderColor 只接受 Bind 池 Token ID，禁止硬编码色值",
    "勾选框圆角固定 radius.xs（4px）",
    "disabled 使用 opacity.disabled",
    "多选是多个 Checkbox 组合，本组件仍为单布尔"
  ],
  "propsSchema": {
    "type": "object",
    "additionalProperties": false,
    "properties": {
      "label": {
        "type": "string"
      },
      "modelValue": {
        "type": "boolean"
      },
      "selectedColor": {
        "type": "string",
        "description": "Checked fill / checkmark Token-ref."
      },
      "uncheckedBorderColor": {
        "type": "string",
        "description": "Unchecked border Token-ref."
      },
      "disabled": {
        "type": "boolean"
      }
    },
    "required": ["label"]
  },
  "defaultProps": {
    "label": "仅查看高优先级",
    "modelValue": true,
    "selectedColor": "color.primary",
    "uncheckedBorderColor": "color.outline",
    "disabled": false
  },
  "states": [
    {
      "id": "unchecked",
      "label": "未选中",
      "kind": "content",
      "props": {
        "modelValue": false
      }
    },
    {
      "id": "disabled",
      "label": "禁用",
      "kind": "interaction",
      "props": {
        "disabled": true
      }
    }
  ],
  "slots": [],
  "events": ["update:modelValue"],
  "tokenBindings": {
    "selected": "color.primary",
    "onSelected": "color.on-primary",
    "uncheckedBorder": "color.outline",
    "text": "color.on-surface",
    "target": "size.touch",
    "radius": "radius.mark",
    "label": "typography.content",
    "disabledOpacity": "opacity.disabled"
  },
  "playground": {
    "presentation": "interactive"
  }
}
